{
  "$schema": "https://json-schema.org/draft/2020-12/schema",
  "title": "tagteam project configuration, version 10",
  "type": "object",
  "additionalProperties": false,
  "required": [
    "version", "base", "branchPrefix", "conventionsPath", "models", "effort",
    "reviewers", "verify", "ciWaitSec", "worktree", "reviewExclude",
    "maxConcurrentCodex", "limits", "escalation", "plan", "planBranch", "versionFiles"
  ],
  "properties": {
    "version": { "const": 10, "type": "integer" },
    "base": {
      "type": "string",
      "minLength": 1,
      "description": "The branch pull requests target and each spec branches from."
    },
    "branchPrefix": {
      "type": "string",
      "minLength": 1,
      "description": "Prefix for generated branches, e.g. tagteam/."
    },
    "conventionsPath": {
      "type": ["string", "null"],
      "description": "A repository document implementers and reviewers are told to read. Null when there is none."
    },
    "models": {
      "$ref": "#/$defs/roleModels",
      "description": "The $ref is the whole rule here; a keyword placed beside it is discarded."
    },
    "effort": {
      "$ref": "#/$defs/jobEffort",
      "description": "The $ref is the whole rule here; a keyword placed beside it is discarded."
    },
    "reviewers": {
      "type": "object",
      "additionalProperties": false,
      "required": ["roster", "default"],
      "properties": {
        "roster": {
          "type": "array",
          "minItems": 1,
          "uniqueItems": true,
          "items": { "type": "string", "pattern": "^[a-z][a-z0-9-]*$" },
          "description": "Every lens a plan may assign to a spec."
        },
        "default": {
          "type": "array",
          "uniqueItems": true,
          "items": { "type": "string", "pattern": "^[a-z][a-z0-9-]*$" },
          "description": "Lenses applied to every spec unless that spec removes one. A Codex cross-review and the adversary run in addition, always."
        }
      }
    },
    "verify": {
      "type": "array",
      "description": "Commands proving a candidate works. Zero matching commands is reported as not-applicable and waits for a person rather than passing.",
      "items": {
        "type": "object",
        "additionalProperties": false,
        "required": ["command", "when", "timeoutSec"],
        "properties": {
          "command": { "type": "string", "minLength": 1 },
          "when": {
            "type": "object",
            "additionalProperties": false,
            "required": ["globs", "keywords"],
            "properties": {
              "globs": { "type": "array", "items": { "type": "string" } },
              "keywords": { "type": "array", "items": { "type": "string" } }
            },
            "description": "Empty globs and empty keywords mean the command always runs."
          },
          "timeoutSec": { "type": "integer", "minimum": 1, "maximum": 7200 }
        }
      }
    },
    "ciWaitSec": {
      "type": "integer",
      "minimum": 0,
      "maximum": 21600,
      "description": "How long to wait for GitHub checks, counted from when a check first appears on the pull request. Still pending at the deadline counts as not-run, which waits for a person. Zero skips CI entirely."
    },
    "ciStartWaitSec": {
      "type": "integer",
      "minimum": 0,
      "maximum": 3600,
      "description": "How long to wait for a first check to appear on a pull request whose commit has a workflow that runs on pull requests, before stopping for a person. The one key that may be missing: a missing key means 120. Zero turns the start wait off."
    },
    "autoMerge": {
      "type": "boolean",
      "description": "Accepted and has no effect: nothing reads it, in either value. A spec that merges straight into the base always waits for a person, and `planBranch` replaced this key as the setting that lets specs merge without waiting. It stays declared, and optional, so that the version-10 files that carry it stay valid and current."
    },
    "worktree": {
      "type": "object",
      "additionalProperties": false,
      "required": ["setup", "copyUntracked", "setupTimeoutSec"],
      "properties": {
        "setup": {
          "type": "array",
          "items": { "type": "string", "minLength": 1 },
          "description": "Commands making a fresh worktree buildable, e.g. npm ci."
        },
        "copyUntracked": {
          "type": "array",
          "items": { "type": "string" },
          "description": "Ignored files a build needs, e.g. .env.test. Each must be ignored at its destination or the copy is refused."
        },
        "setupTimeoutSec": { "type": "integer", "minimum": 1, "maximum": 7200 }
      }
    },
    "reviewExclude": {
      "type": "array",
      "items": { "type": "string" },
      "description": "Globs whose contents are summarised rather than included in the review diff — lock files, snapshots, generated code."
    },
    "maxConcurrentCodex": {
      "type": "integer",
      "minimum": 1,
      "maximum": 16,
      "description": "How many Codex calls may run at once across this repository. The cap spans every ship running here rather than allowing this many per ship, so raise it if you ship several plans at the same time."
    },
    "limits": {
      "type": "object",
      "additionalProperties": false,
      "required": ["fixRounds", "ciRepairs"],
      "properties": {
        "fixRounds": {
          "type": "integer",
          "minimum": 1,
          "description": "How many rounds of fixes a candidate may take before the spec stops for a person. Each round is followed by a full review panel."
        },
        "ciRepairs": {
          "type": "integer",
          "minimum": 1,
          "description": "How many times a red pull request may be repaired. Each repair produces a new candidate that runs the whole review cycle again with a fresh fix budget."
        }
      }
    },
    "escalation": {
      "type": ["object", "null"],
      "additionalProperties": false,
      "required": ["after", "models", "effort"],
      "description": "Raised settings for a ship cycle whose fix rounds have stalled. Null is the ordinary behaviour: every dispatch runs at `models` and `effort`.",
      "properties": {
        "after": {
          "type": "integer",
          "minimum": 1,
          "description": "How many fix rounds run at the ordinary settings before the raised ones take over. At least 1: the ordinary settings always get one fix round, and wanting the raised model from the first fix is already expressible by setting `models`/`effort` to it."
        },
        "models": {
          "$ref": "#/$defs/roleModels",
          "description": "The $ref is the whole rule here; a keyword placed beside it is discarded."
        },
        "effort": {
          "$ref": "#/$defs/jobEffort",
          "description": "The $ref is the whole rule here; a keyword placed beside it is discarded."
        }
      }
    },
    "plan": {
      "type": ["object", "null"],
      "additionalProperties": false,
      "required": ["models", "effort"],
      "description": "Settings for the whole of /tagteam:plan, replacing `models` and `effort` there. Null is the ordinary behaviour: every dispatch runs at `models` and `effort`.",
      "properties": {
        "models": {
          "$ref": "#/$defs/roleModels",
          "description": "The $ref is the whole rule here; a keyword placed beside it is discarded."
        },
        "effort": {
          "$ref": "#/$defs/jobEffort",
          "description": "The $ref is the whole rule here; a keyword placed beside it is discarded."
        }
      }
    },
    "planBranch": {
      "type": "boolean",
      "description": "When true, a plan of two or more specs collects its spec pull requests on a branch of its own, plan/<slug>, and nothing from it reaches base until the plan is complete; false ships every spec straight to base."
    },
    "versionFiles": {
      "type": "array",
      "description": "The lines that carry this repository's version, each a repository-relative file and one place in it — a JSON Pointer into a JSON file, or a line pattern with exactly one capture group — where one file may appear more than once, and an empty list means a ship never makes a version increase.",
      "items": {
        "anyOf": [
          {
            "type": "object",
            "additionalProperties": false,
            "required": ["file", "pointer"],
            "properties": {
              "file": { "type": "string", "minLength": 1 },
              "pointer": { "type": "string", "pattern": "^(/([^~/]|~[01])*)+$" }
            }
          },
          {
            "type": "object",
            "additionalProperties": false,
            "required": ["file", "pattern"],
            "properties": {
              "file": { "type": "string", "minLength": 1 },
              "pattern": { "type": "string", "minLength": 1 }
            }
          }
        ]
      }
    }
  },
  "$defs": {
    "claudeModel": { "type": "string", "enum": ["opus", "fable", "sonnet"] },
    "claudeEffort": { "type": "string", "enum": ["low", "medium", "high", "xhigh", "max"] },
    "roleModels": {
      "type": "object",
      "additionalProperties": false,
      "required": ["lead", "worker", "codex"],
      "description": "The model each role is dispatched at. `lead` is every reader and planner (reviewer, re-check, adversary, explorer, plan-drafter, plan-reviewer, spec-writer); `worker` is the implementer and the fixer; `codex` is the model every Codex call runs. Every site carrying a role triple $refs this one, so a role added here is a role added everywhere. Note that `validate-json.mjs` returns on a $ref: a keyword written beside one of those $refs is silently ignored, so anything extra a site needs belongs here instead. Codex model names are not enumerable, which is why `codex` is a non-empty string.",
      "properties": {
        "lead": { "$ref": "#/$defs/claudeModel" },
        "worker": { "$ref": "#/$defs/claudeModel" },
        "codex": { "type": "string", "minLength": 1 }
      }
    },
    "jobEffort": {
      "type": "object",
      "additionalProperties": false,
      "required": ["implementer", "fixer", "reviewer", "recheck", "adversary", "planner", "codex"],
      "description": "The thinking effort each job is dispatched at. A reader that only has to answer whether one fix landed (`recheck`) needs less than a reader looking for what is wrong (`reviewer`), which needs less than the one writing the code (`implementer`). `planner` covers the explorer, the plan-drafter, the plan-reviewer and the spec-writer; `adversary` covers both the plan adversary and the code adversary; `codex` covers every Codex call. Every site carrying an effort map $refs this one. The Codex ladder is its own inline list rather than a $ref to the Claude one, though the two now hold the same words: `$defs.claudeEffort` is the ladder Claude dispatches are checked against, and Codex's words are Codex's to change.",
      "properties": {
        "implementer": { "$ref": "#/$defs/claudeEffort" },
        "fixer": { "$ref": "#/$defs/claudeEffort" },
        "reviewer": { "$ref": "#/$defs/claudeEffort" },
        "recheck": { "$ref": "#/$defs/claudeEffort" },
        "adversary": { "$ref": "#/$defs/claudeEffort" },
        "planner": { "$ref": "#/$defs/claudeEffort" },
        "codex": { "type": "string", "enum": ["low", "medium", "high", "xhigh", "max"] }
      }
    }
  }
}
